ncr_id,title,reference,status,revision,creator,department_creator,updated_by,updated_date,location,description,initial_analysis,data_significant,date_occurrence,cause_of_ncr,close_out_date,reason_closure,disposition,person_responsible,department_responsible,nrb_participant_email,nrb_participant_name,nrb_participant_type,decision_date,decision_type,classification_initiator,classification_confirmer,classification_prima,linked_inspection_id,site,supplier,part_number,severity,opened_at
NCR-2024-046,Optical Inspection Reject Rate High,REF-046,IN_REVIEW,2,Mike Johnson,Automated Inspection,Robert Chen,2024-05-13,Factory-A Vision System,Vision system rejecting 15% of good parts - false rejection,Camera calibration or lighting degradation,Yes,2024-04-25,Vision system camera lens contamination,,,System being recalibrated and lighting upgraded,Tom Hardy,Automation Engineering,automation@acmecorp.com,Mike Johnson,Automation Engineer,2024-05-08,System optimization,AUTO-001,PROD-010,QC-027,,Factory-A,Acme Corp,PN-65320,MEDIUM,2024-04-25 11:00:00
NCR-2024-047,Weld Spatter Excessive,REF-047,CLOSED,1,Sarah Lee,Weld Inspection,Alice Brown,2024-05-15,Factory-B Welding,Excessive weld spatter requiring additional cleaning operations,Welding parameters or shielding gas issue,No,2024-04-28,Welding wire feed speed too high,2024-05-15,Welding parameters optimized. Spatter reduced to acceptable levels.,Accept,Jane Doe,Welding,weld@betaindustries.com,Sarah Lee,Weld Engineer,2024-05-10,Process adjustment,WELD-002,QC-028,PROD-011,,Factory-B,Beta Industries,PN-54210,LOW,2024-04-28 13:45:00
NCR-2024-048,Crimp Pull Test Failure,REF-048,OPEN,1,Jane Doe,Electrical Assembly,Mike Johnson,2024-05-18,Factory-C Wire Shop,Wire crimp failed pull test at 18 lbs vs minimum 25 lbs,Crimping die wear or wrong die selection,Yes,2024-05-01,Crimping tool die worn,,,All crimps from same tool being inspected. Die replacement scheduled.,Robert Chen,Wire Harness Eng,harness@deltasupply.com,Jane Doe,Harness Engineer,2024-05-13,100% inspection,CRIMP-001,TEST-004,QC-029,,Factory-C,Delta Supply,PN-43120,HIGH,2024-05-01 09:30:00
NCR-2024-049,Helium Leak Above Specification,REF-049,IN_REVIEW,1,Tom Hardy,Leak Test,Sarah Lee,2024-05-20,Factory-A Leak Test,Leak rate at 5x10^-7 cc/sec vs maximum 1x10^-7 cc/sec,Seal or weld defect,Yes,2024-05-03,Weld micro-crack detected in radiography,,,Weld repair procedure being developed,Dr. Lisa Wang,Welding Metallurgy,weldmet@acmecorp.com,Tom Hardy,Leak Test Tech,2024-05-15,Repair evaluation,LEAK-001,TEST-005,ENG-012,,Factory-A,Acme Corp,PN-32010,CRITICAL,2024-05-03 14:15:00
NCR-2024-050,Statistical Sampling Plan Violation,REF-050,CLOSED,1,Robert Chen,Quality Audit,Jane Doe,2024-05-22,Factory-B Quality,Sampling plan requires 32 samples but only 20 were inspected,Audit finding - procedure not followed,No,2024-05-05,Inspector procedural error,2024-05-22,Additional samples inspected - all passed. Inspector retrained on sampling requirements.,Accept after verification,Alice Brown,Quality Management,qm@betaindustries.com,Robert Chen,QA Auditor,2024-05-18,Verify compliance,AUDIT-001,QC-030,OPS-011,,Factory-B,Beta Industries,PN-21900,MEDIUM,2024-05-05 16:00:00
